{
  "computed_on": "2026-10-10",
  "detectors": "8d3a03679e0d",
  "measures": {
    "agent_seconds": {
      "basis": "seconds",
      "direction": "higher_is_worse",
      "enabled": true,
      "fires": false,
      "label": "Agent time",
      "natural": {
        "centre": 41.75,
        "lcl": null,
        "method": "average_moving_range",
        "moving_range": 29.0,
        "mr_ucl": 94.772,
        "provisional": true,
        "sessions": 8,
        "sigma": 25.70922,
        "ucl": 118.89
      },
      "rules": [
        "beyond_limits",
        "two_of_three",
        "four_of_five",
        "run_of_eight"
      ],
      "tuned": null
    },
    "avoidable_share": {
      "basis": "ratio",
      "direction": "higher_is_worse",
      "enabled": true,
      "fires": true,
      "label": "Avoidable share of generated tokens",
      "natural": {
        "centre": 0.114844,
        "lcl": null,
        "method": "average_moving_range",
        "moving_range": 0.171865,
        "mr_ucl": 0.561654,
        "provisional": true,
        "sessions": 8,
        "sigma": 0.152362,
        "ucl": 0.572004
      },
      "rules": [
        "beyond_limits",
        "two_of_three",
        "four_of_five",
        "run_of_eight"
      ],
      "tuned": null
    },
    "confident_findings": {
      "basis": "count",
      "direction": "higher_is_worse",
      "enabled": true,
      "fires": true,
      "label": "Confident waste findings",
      "natural": {
        "centre": 1.25,
        "lcl": null,
        "method": "average_moving_range",
        "moving_range": 2.142857,
        "mr_ucl": 7.002857,
        "provisional": true,
        "sessions": 8,
        "sigma": 1.899696,
        "ucl": 6.95
      },
      "rules": [
        "beyond_limits",
        "two_of_three",
        "four_of_five",
        "run_of_eight"
      ],
      "tuned": null
    },
    "edits_validated_share": {
      "basis": "ratio",
      "direction": "lower_is_worse",
      "enabled": true,
      "fires": true,
      "label": "Edits covered by a later validation run",
      "natural": {
        "centre": 0.75,
        "lcl": null,
        "method": "average_moving_range",
        "moving_range": 0.428571,
        "mr_ucl": 1.400571,
        "provisional": true,
        "sessions": 8,
        "sigma": 0.379939,
        "ucl": null
      },
      "rules": [
        "beyond_limits",
        "two_of_three",
        "four_of_five",
        "run_of_eight"
      ],
      "tuned": null
    },
    "flow_efficiency_time": {
      "basis": "ratio",
      "direction": "lower_is_worse",
      "enabled": true,
      "fires": true,
      "label": "Flow efficiency (time)",
      "natural": {
        "centre": 0.8505,
        "lcl": 0.386349,
        "method": "average_moving_range",
        "moving_range": 0.174493,
        "mr_ucl": 0.570243,
        "provisional": true,
        "sessions": 8,
        "sigma": 0.154692,
        "ucl": null
      },
      "rules": [
        "beyond_limits",
        "two_of_three",
        "four_of_five",
        "run_of_eight"
      ],
      "tuned": null
    },
    "flow_efficiency_tokens": {
      "basis": "ratio",
      "direction": "lower_is_worse",
      "enabled": true,
      "fires": true,
      "label": "Flow efficiency (tokens)",
      "natural": {
        "centre": 0.836432,
        "lcl": 0.488859,
        "method": "average_moving_range",
        "moving_range": 0.130666,
        "mr_ucl": 0.427018,
        "provisional": true,
        "sessions": 8,
        "sigma": 0.115839,
        "ucl": null
      },
      "rules": [
        "beyond_limits",
        "two_of_three",
        "four_of_five",
        "run_of_eight"
      ],
      "tuned": null
    },
    "generated_tokens": {
      "basis": "tokens",
      "direction": "higher_is_worse",
      "enabled": true,
      "fires": false,
      "label": "Generated tokens",
      "natural": {
        "centre": 413.625,
        "lcl": null,
        "method": "average_moving_range",
        "moving_range": 179.571429,
        "mr_ucl": 586.839429,
        "provisional": true,
        "sessions": 8,
        "sigma": 159.194529,
        "ucl": 891.285
      },
      "rules": [
        "beyond_limits",
        "two_of_three",
        "four_of_five",
        "run_of_eight"
      ],
      "tuned": null
    },
    "rework_cycles": {
      "basis": "count",
      "direction": "higher_is_worse",
      "enabled": true,
      "fires": true,
      "label": "Rework cycles (same failure)",
      "natural": {
        "centre": 0.125,
        "lcl": null,
        "method": "average_moving_range",
        "moving_range": 0.285714,
        "mr_ucl": 0.933714,
        "provisional": true,
        "sessions": 8,
        "sigma": 0.253293,
        "ucl": 0.885
      },
      "rules": [
        "beyond_limits",
        "two_of_three",
        "four_of_five",
        "run_of_eight"
      ],
      "tuned": null
    },
    "risk_findings": {
      "basis": "count",
      "direction": "higher_is_worse",
      "enabled": true,
      "fires": true,
      "label": "Risk findings",
      "natural": {
        "centre": 0.875,
        "lcl": null,
        "method": "average_moving_range",
        "moving_range": 1.285714,
        "mr_ucl": 4.201714,
        "provisional": true,
        "sessions": 8,
        "sigma": 1.139818,
        "ucl": 4.295
      },
      "rules": [
        "beyond_limits",
        "two_of_three",
        "four_of_five",
        "run_of_eight"
      ],
      "tuned": null
    },
    "ter": {
      "basis": "ratio",
      "direction": "lower_is_worse",
      "enabled": true,
      "fires": true,
      "label": "Token Efficiency Ratio",
      "natural": {
        "centre": 0.788137,
        "lcl": 0.375229,
        "method": "average_moving_range",
        "moving_range": 0.155229,
        "mr_ucl": 0.507287,
        "provisional": true,
        "sessions": 8,
        "sigma": 0.137614,
        "ucl": null
      },
      "rules": [
        "beyond_limits",
        "two_of_three",
        "four_of_five",
        "run_of_eight"
      ],
      "tuned": null
    },
    "uncertain_findings": {
      "basis": "count",
      "direction": "higher_is_worse",
      "enabled": true,
      "fires": true,
      "label": "Uncertain findings (waste until verified)",
      "natural": {
        "centre": 0.5,
        "lcl": null,
        "method": "average_moving_range",
        "moving_range": 0.428571,
        "mr_ucl": 1.400571,
        "provisional": true,
        "sessions": 8,
        "sigma": 0.379939,
        "ucl": 1.64
      },
      "rules": [
        "beyond_limits",
        "two_of_three",
        "four_of_five",
        "run_of_eight"
      ],
      "tuned": null
    },
    "unresolved_failures_at_end": {
      "basis": "count",
      "direction": "higher_is_worse",
      "enabled": true,
      "fires": true,
      "label": "Failing checks never seen passing again",
      "natural": {
        "centre": 0.125,
        "lcl": null,
        "method": "average_moving_range",
        "moving_range": 0.285714,
        "mr_ucl": 0.933714,
        "provisional": true,
        "sessions": 8,
        "sigma": 0.253293,
        "ucl": 0.885
      },
      "rules": [
        "beyond_limits",
        "two_of_three",
        "four_of_five",
        "run_of_eight"
      ],
      "tuned": null
    },
    "unvalidated_edits_at_end": {
      "basis": "count",
      "direction": "higher_is_worse",
      "enabled": true,
      "fires": true,
      "label": "Edits no validation run covered",
      "natural": {
        "centre": 0.375,
        "lcl": null,
        "method": "average_moving_range",
        "moving_range": 0.571429,
        "mr_ucl": 1.867429,
        "provisional": true,
        "sessions": 8,
        "sigma": 0.506586,
        "ucl": 1.895
      },
      "rules": [
        "beyond_limits",
        "two_of_three",
        "four_of_five",
        "run_of_eight"
      ],
      "tuned": null
    },
    "unverified_waste_share": {
      "basis": "ratio",
      "direction": "higher_is_worse",
      "enabled": true,
      "fires": true,
      "label": "Avoidable plus unverified share of generated tokens",
      "natural": {
        "centre": 0.163568,
        "lcl": null,
        "method": "average_moving_range",
        "moving_range": 0.130666,
        "mr_ucl": 0.427018,
        "provisional": true,
        "sessions": 8,
        "sigma": 0.115839,
        "ucl": 0.511141
      },
      "rules": [
        "beyond_limits",
        "two_of_three",
        "four_of_five",
        "run_of_eight"
      ],
      "tuned": null
    },
    "value_adding_share": {
      "basis": "ratio",
      "direction": "lower_is_worse",
      "enabled": true,
      "fires": true,
      "label": "Value-adding share of generated tokens",
      "natural": {
        "centre": 0.506667,
        "lcl": 0.119805,
        "method": "average_moving_range",
        "moving_range": 0.145437,
        "mr_ucl": 0.475288,
        "provisional": true,
        "sessions": 8,
        "sigma": 0.128933,
        "ucl": 0.893529
      },
      "rules": [
        "beyond_limits",
        "two_of_three",
        "four_of_five",
        "run_of_eight"
      ],
      "tuned": null
    },
    "wip_peak": {
      "basis": "count",
      "direction": "higher_is_worse",
      "enabled": true,
      "fires": true,
      "label": "Peak WIP",
      "natural": {
        "centre": 3.375,
        "lcl": null,
        "method": "average_moving_range",
        "moving_range": 2.857143,
        "mr_ucl": 9.337143,
        "provisional": true,
        "sessions": 8,
        "sigma": 2.532928,
        "ucl": 10.975
      },
      "rules": [
        "beyond_limits",
        "two_of_three",
        "four_of_five",
        "run_of_eight"
      ],
      "tuned": null
    }
  },
  "method": "average_moving_range",
  "rules": {
    "beyond_limits": "One session outside a control limit.",